{
  "$schema": "../../scripts/sc2-composer/schema/CommanderPackage.schema.json",
  "schemaVersion": 1,
  "commanderId": "TerranRaynor",
  "displayName": "雷诺",
  "dataCenter": "Commander.Raynor",
  "modPath": "Mods/7vs1/CommanderUnits_Raynor.SC2Mod",
  "techTree": {
    "buildings": [
      "CommandCenterRaynor",
      "OrbitalCommandRaynor",
      "BarracksRaynor",
      "FactoryRaynor",
      "StarportRaynor",
      "CommandCenterFlyingRaynor",
      "OrbitalCommandFlyingRaynor",
      "BarracksFlyingRaynor",
      "FactoryFlyingRaynor",
      "StarportFlyingRaynor",
      "TechLabRaynor",
      "ReactorRaynor",
      "BarracksTechLabRaynor",
      "BarracksReactorRaynor",
      "FactoryTechLabRaynor",
      "FactoryReactorRaynor",
      "StarportTechLabRaynor",
      "StarportReactorRaynor",
      "SupplyDepotRaynor",
      "RefineryRaynor",
      "EngineeringBayRaynor",
      "BunkerRaynor",
      "MissileTurretRaynor",
      "SensorTowerRaynor",
      "ArmoryRaynor",
      "FusionCoreRaynor",
      "Barracks",
      "Factory",
      "Starport"
    ],
    "units": [
      "SCVRaynor",
      "MarineRaynor",
      "MedicRaynor",
      "FirebatRaynor",
      "MarauderRaynor",
      "VultureRaynor",
      "SiegeTankRaynor",
      "SiegeTankSiegedRaynor",
      "VikingRaynor",
      "VikingAssaultRaynor",
      "BansheeRaynor",
      "BattlecruiserRaynor",
      "CoopCasterRaynor",
      "CoopAssistCasterRaynor",
      "RaynorCommando",
      "RaynorCommandoMarine",
      "Raynor",
      "Raynor01",
      "RaynorLab",
      "RaynorsRaidersDropship",
      "MutatorAmonRaynor"
    ],
    "upgrades": [],
    "abilities": [
      "RaynorCommandoMarineHangar"
    ]
  },
  "runtimeHooks": {
    "initFunction": "libE0EAE146_gf_RaynorRuntimeInit",
    "applyTechFunction": "libE0EAE146_gf_RaynorApplyTechFilter",
    "createStartSquadFunction": "libE0EAE146_gf_RaynorCreateMapStartSquad"
  },
  "panelLayout": {
    "topPanelAbilities": [
      "VoidCoopSummonHyperion",
      "BansheeAirstrike"
    ],
    "commandCardLayouts": [
      {
        "unitId": "CoopCasterRaynor",
        "layout": "UnitData_Raynor.xml#CoopCasterRaynor"
      },
      {
        "unitId": "CoopAssistCasterRaynor",
        "layout": "UnitData_Raynor.xml#CoopAssistCasterRaynor"
      },
      {
        "unitId": "RaynorCommando",
        "layout": "UnitData_Raynor.xml#RaynorCommando"
      }
    ]
  },
  "prestiges": [
    {
      "id": "CommanderPrestigeRaynorBio",
      "name": "死水元帅",
      "modifier": "生物战斗单位生命值+100%；矿骡不可用"
    },
    {
      "id": "CommanderPrestigeRaynorMechAfterburners",
      "name": "狂暴骑手",
      "modifier": "后燃推进系统攻速+100%，冷却-50%；单位消耗不再减少，后燃消耗10生命且移速加成降至50%"
    },
    {
      "id": "CommanderPrestigeRaynorAir",
      "name": "起义军游骑兵",
      "modifier": "星港/军械库/轨道控制基地无科技需求，星港无瓦斯消耗且其单位瓦斯消耗降30%；战斗单位晶体矿消耗+50%"
    }
  ],
  "masteries": [
    {
      "id": "RaynorMastery1",
      "name": "资源费用",
      "stat": "cost"
    },
    {
      "id": "RaynorMastery2",
      "name": "空投舱急速",
      "stat": "dropPodHaste"
    },
    {
      "id": "RaynorMastery3",
      "name": "休伯利安号冷却时间",
      "stat": "hyperionCooldown"
    },
    {
      "id": "RaynorMastery4",
      "name": "女妖冷却时间",
      "stat": "duskWingCooldown"
    },
    {
      "id": "RaynorMastery5",
      "name": "医疗兵额外目标治疗",
      "stat": "medicSecondaryHeal"
    },
    {
      "id": "RaynorMastery6",
      "name": "机械部队攻击速度",
      "stat": "mechAttackSpeed"
    }
  ],
  "compatibleMapFamilies": [],
  "incompatibleMapFamilies": []
}
